<?xml version="1.0" encoding="UTF-8"?>
<sd:section_definition xmlns:sd="sd" xmlns:xsi="http://www.w3.org/2001/XMLSchema-instance" xsi:schemaLocation="sd SectionDefinition.xsd ">
	<sd:health>100</sd:health>
	<sd:section_name>front_armour_right</sd:section_name>
	<sd:texture_path>front_armour_right.png</sd:texture_path>
	<sd:section_position>
		<sd:position>
			<sd:x>186.5</sd:x>
			<sd:y>-62.5</sd:y>
		</sd:position>
	</sd:section_position>
	<sd:texture_dimensions>
		<sd:dimension>
			<sd:width>200</sd:width>
			<sd:height>125</sd:height>
		</sd:dimension>
	</sd:texture_dimensions>
	<sd:vertices>
		<sd:vertex>
			<sd:x>15.0</sd:x>
			<sd:y>0.0</sd:y>
		</sd:vertex>
		<sd:vertex>
			<sd:x>15.0</sd:x>
			<sd:y>45.0</sd:y>
		</sd:vertex>
		<sd:vertex>
			<sd:x>0.0</sd:x>
			<sd:y>55.0</sd:y>
		</sd:vertex>
		<sd:vertex>
			<sd:x>0.0</sd:x>
			<sd:y>112.0</sd:y>
		</sd:vertex>
		<sd:vertex>
			<sd:x>15.0</sd:x>
			<sd:y>125.0</sd:y>
		</sd:vertex>
		<sd:vertex>
			<sd:x>30.0</sd:x>
			<sd:y>125.0</sd:y>
		</sd:vertex>
		<sd:vertex>
			<sd:x>93.0</sd:x>
			<sd:y>77.0</sd:y>
		</sd:vertex>
		<sd:vertex>
			<sd:x>93.0</sd:x>
			<sd:y>63.0</sd:y>
		</sd:vertex>
		<sd:vertex>
			<sd:x>80.0</sd:x>
			<sd:y>55.0</sd:y>
		</sd:vertex>
		<sd:vertex>
			<sd:x>80.0</sd:x>
			<sd:y>31.0</sd:y>
		</sd:vertex>
		<sd:vertex>
			<sd:x>94.0</sd:x>
			<sd:y>20.0</sd:y>
		</sd:vertex>
		<sd:vertex>
			<sd:x>185.0</sd:x>
			<sd:y>20.0</sd:y>
		</sd:vertex>
		<sd:vertex>
			<sd:x>200.0</sd:x>
			<sd:y>10.0</sd:y>
		</sd:vertex>
		<sd:vertex>
			<sd:x>200.0</sd:x>
			<sd:y>0.0</sd:y>
		</sd:vertex>
	</sd:vertices>
</sd:section_definition>
